{
  "id": "DISC-DOCULYRA-FRAMEWORK-2026-08-29",
  "assessedAt": "2026-08-29T15:00:00+10:00",
  "scope": "Agent Engineering Framework bootstrap and current Doculyra repository/control-plane assessment; no unrelated product feature implementation",
  "baseline": {
    "branch": "main",
    "revision": "7b62573",
    "remote": "origin/main",
    "workingTreeAtStart": "clean",
    "repository": "syedtabishmobin/DocumentManagement",
    "visibility": "private"
  },
  "evidence": [
    "Complete supplied Agent Engineering Framework v1.1.0, Doculyra profile, and Codex operating guide",
    "AGENTS.md, CODEX.md, decision register, specification packs, ADRs, implementation status and remaining-work register",
    "React/NestJS/Flutter implementation, tests, package scripts, CI workflows, Bicep/environment sources, deployment evidence and security/privacy specifications",
    "Recent Git history including temporary handover lifecycle and latest multi-workspace authorization foundation",
    "Live GitHub repository, Issues, pull requests, labels, workflows/runs, environments, rules/protection availability, Actions secret names and variable names",
    "External provider and Azure Communication Services Email configuration/status"
  ],
  "dispositions": [
    {"area": "Existing specification-first governance and source hierarchy", "decision": "REUSE", "evidence": "CODEX.md and the numbered specification packs are coherent, linked, checksum/validator protected, and authorised by DEC-041/DEC-054."},
    {"area": "Application implementation and current evidence", "decision": "REUSE", "evidence": "The current synthetic preview and local multi-workspace authority foundation are evidence-backed; status correctly records zero complete stories and remaining gaps."},
    {"area": "Agent operating/control plane", "decision": "EXTEND", "evidence": "No .agents framework, structured role/protocol/capability/tool configuration, Issue forms, notification ledger, or onboarding guide existed."},
    {"area": "CI and repository commands", "decision": "REFACTOR", "evidence": "Existing pnpm/Flutter/Bicep gates pass and remain authoritative; framework validation is added to their existing root entry point."},
    {"area": "GitHub work-management conventions", "decision": "EXTEND", "evidence": "Issues are enabled but there were zero Issues, zero pull requests, only generic labels, no forms/CODEOWNERS, and no remote protection rules."},
    {"area": "Product Authority email notification", "decision": "EXTEND", "evidence": "ACS development infrastructure and managed identity are prepared, but the runtime adapter, recipient allow-list, reconciliation and delivery conformance are absent; external notifications remain disabled."},
    {"area": "Existing product/framework documentation", "decision": "REPLACE_SELECTIVELY", "evidence": "Only exact operating-command/path descriptions are updated; reusable policy is not copied into the human guide and approved product rules are preserved."}
  ],
  "consultations": [
    "Delivery Orchestrator perspective: dependency order and bounded bootstrap scope",
    "Product/BA perspective: GitHub Issues authority, acceptance and future-user continuity",
    "Architecture Guardian perspective: separation of reusable framework, project profile, product specifications and adapter ports",
    "QA/Release perspective: independent evidence, environment/UAT gates and truthful external status",
    "Repository Steward perspective: CI, CODEOWNERS, forms, validators and plan-limited remote enforcement",
    "Security/Privacy and Reliability perspectives: least privilege, no secrets, recipient deduplication, exactly-once ledger, delivery reconciliation and no simulated email",
    "Persistent-role review was performed in the current agent context because no native subagent tool was exposed in this session"
  ],
  "risks": [
    "Remote main-branch protection is procedural because the private repository plan does not expose rulesets/protection enforcement.",
    "GitHub Environments are absent and deployment workflows are not wired to Stage/production approval gates.",
    "Product Authority and UAT email delivery is not operational until the ACS adapter and conformance evidence exist.",
    "Current application remains a synthetic preview with zero stories satisfying complete definition of done."
  ],
  "recommendation": "Preserve the existing specification and implementation baseline, add the separate validated agent control plane, create the remote governance decision and queue, then continue with transactional durable authority persistence and complete authorization boundaries before connector activation."
}
