{
  "id": "DISC-DOCULYRA-AUTH-PREVIEW-REPAIR-2026-09-02",
  "assessedAt": "2026-09-02T19:52:43+10:00",
  "scope": "Issue #74 Azure DEV synthetic email registration/sign-in repair, truthful DEC-038 recovery-unavailable UX, immutable artifact deployment, and evidence-based CI efficiency review",
  "baseline": {
    "branch": "codex/74-auth-preview-repair",
    "revision": "0aa964f7d6c332814c35eafbb2a84de300051637",
    "workingTreeAtStart": "clean isolated worktree from origin/main; the user's codex/73-story-p1-009 worktree was preserved",
    "repository": "syedtabishmobin/DocumentManagement",
    "authoritativeWorkItem": "https://github.com/syedtabishmobin/DocumentManagement/issues/74",
    "environment": "Azure DEV synthetic preview"
  },
  "evidence": [
    "AGENTS.md, CODEX.md, 04_USING_THIS_REPO_WITH_CODEX.md and current source-of-truth/current-state records",
    "DEC-038, REQ-P1-TRUST-001/008, REQ-P1-PLT-003, STORY-P1-008 and STORY-P1-047",
    "Current React auth UI, API client, NestJS AuthController, IdentityStore, contracts and focused authentication tests",
    "Live DEV browser inspection and user screenshot of the indefinitely pending account-entry startup screen; unauthenticated session timing probe; schema-invalid register/login probes; Azure Container App console evidence; observed API minReplicas=0",
    "Observed DEV web image dev-b5720beedd6afa908a823775efeab88b4d47968a and API image dev-8e39e77a9a94d43cb5f96ea2c76e53de96c95473",
    "Current Bicep application deployment, dev parameters, container image workflow, branch protection documentation and Phase 1 quality workflow",
    "Seven-day agent summary with token, provider-cost and context-efficiency values truthfully UNAVAILABLE"
  ],
  "dispositions": [
    {
      "area": "Local email/password identity, session and abuse controls",
      "decision": "REUSE",
      "evidence": "Current implementation already uses scrypt, hashed session/CSRF tokens, strict cookies, origin/CSRF checks, bounded sessions, revocation and persisted throttling with focused regression coverage."
    },
    {
      "area": "Authentication input error boundary",
      "decision": "EXTEND",
      "evidence": "Manual Zod parsing currently escapes through NestJS as HTTP 500. Add a narrow privacy-safe 400 mapping and deterministic controller regression coverage without weakening anti-enumeration."
    },
    {
      "area": "Sign-in recovery guidance",
      "decision": "EXTEND",
      "evidence": "Current source contains a truthful Can’t sign in disclosure, while the deployed web artifact predates it. Preserve DEC-038 and improve test coverage; do not add a reset or transfer success path."
    },
    {
      "area": "External identity, passkeys and password recovery",
      "decision": "REUSE",
      "evidence": "The approved fail-closed unavailable boundary remains authoritative. Provider configuration does not activate adapters, and no recovery route may be invented by this defect repair."
    },
    {
      "area": "Azure DEV application deployment",
      "decision": "REPLACE_SELECTIVELY",
      "evidence": "Retain the existing Container Apps, reverse proxy, managed identity, synthetic Azure Files and Bicep model; replace stale web/API images with immutable exact-candidate artifacts after QA and retain one DEV API replica so interactive account entry does not wait on scale-to-zero."
    },
    {
      "area": "Pull-request quality routing",
      "decision": "REFACTOR",
      "evidence": "The current quality workflow runs specification/PostgreSQL, Android and macOS iOS jobs for every PR with no changed-path classification. A separate governed change should preserve required check names while routing expensive component work by affected paths."
    }
  ],
  "consultations": [
    "ORCH-015: governed scope, release gates and separation from active Story P1-009",
    "DEV-WEB-004: focused Web/API implementation and regression evidence",
    "OPS-001: read-only CI efficiency and provenance analysis",
    "Independent QA role reserved for an isolated exact-candidate retest after implementation"
  ],
  "risks": [
    "Creating a working forgot-password path would violate approved DEC-038 and could introduce a weaker account/workspace/key takeover route.",
    "A healthy GET session endpoint does not prove registration/login writes; exact-candidate and deployed synthetic end-to-end smoke evidence are required.",
    "The DEV Azure Files identity state is synthetic but persistent; smoke fixtures must be unique, non-personal and privacy-safe.",
    "Keeping one 0.5 vCPU / 1 GiB DEV API replica continuously available increases Azure Container Apps cost; exact AUD impact is provider/usage dependent and remains UNAVAILABLE until billing evidence is observed.",
    "Deploying directly without updating immutable Bicep image references would create configuration drift.",
    "Changing test routing in the authentication repair would make product acceptance harder to attribute and could weaken branch protection."
  ],
  "recommendation": "Repair auth validation, bounded startup/retry behavior and recovery-unavailable presentation; retain one DEV API replica; pass focused and protected exact-candidate QA; build immutable candidate images; update reviewed DEV image references; deploy through Bicep; and prove registration/logout/login in DEV with synthetic data. Create a separate governed CI-routing item from OPS-001 evidence rather than weakening this repair's gates."
}
